No.     Time           Source                Destination           Protocol Length Info
    202 273.923309     192.168.137.189       192.168.137.1         HTTP     210    GET /preseed.cfg HTTP/1.1 

Frame 202: 210 bytes on wire (1680 bits), 210 bytes captured (1680 bits) on interface \Device\NPF_{B1286BEE-345E-457C-927E-56EECC0F1C80}, id 0
Ethernet II, Src: Dell_fe:af:19 (00:1e:c9:fe:af:19), Dst: HoshinoM_0f:26:02 (00:06:1c:0f:26:02)
Internet Protocol Version 4, Src: 192.168.137.189, Dst: 192.168.137.1
Transmission Control Protocol, Src Port: 60916, Dst Port: 80, Seq: 1, Ack: 1, Len: 144
Hypertext Transfer Protocol

No.     Time           Source                Destination           Protocol Length Info
    205 273.924507     192.168.137.1         192.168.137.189       HTTP     1250   HTTP/1.0 200 OK 

Frame 205: 1250 bytes on wire (10000 bits), 1250 bytes captured (10000 bits) on interface \Device\NPF_{B1286BEE-345E-457C-927E-56EECC0F1C80}, id 0
Ethernet II, Src: HoshinoM_0f:26:02 (00:06:1c:0f:26:02), Dst: Dell_fe:af:19 (00:1e:c9:fe:af:19)
Internet Protocol Version 4, Src: 192.168.137.1, Dst: 192.168.137.189
Transmission Control Protocol, Src Port: 80, Dst Port: 60916, Seq: 1651, Ack: 145, Len: 1184
[3 Reassembled TCP Segments (2834 bytes): #203(202), #204(1448), #205(1184)]
Hypertext Transfer Protocol
Data (2632 bytes)

0000  23 5f 70 72 65 73 65 65 64 5f 56 31 0a 0a 64 2d   #_preseed_V1..d-
0010  69 20 61 70 74 2d 73 65 74 75 70 2f 6e 6f 6e 2d   i apt-setup/non-
0020  66 72 65 65 2d 66 69 72 6d 77 61 72 65 20 62 6f   free-firmware bo
0030  6f 6c 65 61 6e 20 66 61 6c 73 65 0a 0a 23 20 42   olean false..# B
0040  2e 34 2e 31 2e 20 4c 6f 63 61 6c 69 7a 61 74 69   .4.1. Localizati
0050  6f 6e 0a 0a 64 2d 69 20 64 65 62 69 61 6e 2d 69   on..d-i debian-i
0060  6e 73 74 61 6c 6c 65 72 2f 6c 61 6e 67 75 61 67   nstaller/languag
0070  65 20 73 74 72 69 6e 67 20 65 6e 0a 64 2d 69 20   e string en.d-i 
0080  64 65 62 69 61 6e 2d 69 6e 73 74 61 6c 6c 65 72   debian-installer
0090  2f 63 6f 75 6e 74 72 79 20 73 74 72 69 6e 67 20   /country string 
00a0  53 47 0a 64 2d 69 20 64 65 62 69 61 6e 2d 69 6e   SG.d-i debian-in
00b0  73 74 61 6c 6c 65 72 2f 6c 6f 63 61 6c 65 20 73   staller/locale s
00c0  74 72 69 6e 67 20 65 6e 5f 53 47 2e 55 54 46 2d   tring en_SG.UTF-
00d0  38 0a 64 2d 69 20 6b 65 79 62 6f 61 72 64 2d 63   8.d-i keyboard-c
00e0  6f 6e 66 69 67 75 72 61 74 69 6f 6e 2f 78 6b 62   onfiguration/xkb
00f0  2d 6b 65 79 6d 61 70 20 73 65 6c 65 63 74 20 75   -keymap select u
0100  73 0a 0a 23 20 42 2e 34 2e 32 2e 20 4e 65 74 77   s..# B.4.2. Netw
0110  6f 72 6b 20 63 6f 6e 66 69 67 75 72 61 74 69 6f   ork configuratio
0120  6e 0a 64 2d 69 20 6e 65 74 63 66 67 2f 63 68 6f   n.d-i netcfg/cho
0130  6f 73 65 5f 69 6e 74 65 72 66 61 63 65 20 73 65   ose_interface se
0140  6c 65 63 74 20 65 6e 6f 31 0a 64 2d 69 20 6e 65   lect eno1.d-i ne
0150  74 63 66 67 2f 75 73 65 5f 61 75 74 6f 63 6f 6e   tcfg/use_autocon
0160  66 69 67 20 62 6f 6f 6c 65 61 6e 20 74 72 75 65   fig boolean true
0170  23 5f 70 72 65 73 65 65 64 5f 56 31 0a 0a 64 2d   #_preseed_V1..d-
0180  69 20 61 70 74 2d 73 65 74 75 70 2f 6e 6f 6e 2d   i apt-setup/non-
0190  66 72 65 65 2d 66 69 72 6d 77 61 72 65 20 62 6f   free-firmware bo
01a0  6f 6c 65 61 6e 20 66 61 6c 73 65 0a 0a 23 20 42   olean false..# B
01b0  2e 34 2e 31 2e 20 4c 6f 63 61 6c 69 7a 61 74 69   .4.1. Localizati
01c0  6f 6e 0a 0a 64 2d 69 20 64 65 62 69 61 6e 2d 69   on..d-i debian-i
01d0  6e 73 74 61 6c 6c 65 72 2f 6c 61 6e 67 75 61 67   nstaller/languag
01e0  65 20 73 74 72 69 6e 67 20 65 6e 0a 64 2d 69 20   e string en.d-i 
01f0  64 65 62 69 61 6e 2d 69 6e 73 74 61 6c 6c 65 72   debian-installer
0200  2f 63 6f 75 6e 74 72 79 20 73 74 72 69 6e 67 20   /country string 
0210  53 47 0a 64 2d 69 20 64 65 62 69 61 6e 2d 69 6e   SG.d-i debian-in
0220  73 74 61 6c 6c 65 72 2f 6c 6f 63 61 6c 65 20 73   staller/locale s
0230  74 72 69 6e 67 20 65 6e 5f 53 47 2e 55 54 46 2d   tring en_SG.UTF-
0240  38 0a 64 2d 69 20 6b 65 79 62 6f 61 72 64 2d 63   8.d-i keyboard-c
0250  6f 6e 66 69 67 75 72 61 74 69 6f 6e 2f 78 6b 62   onfiguration/xkb
0260  2d 6b 65 79 6d 61 70 20 73 65 6c 65 63 74 20 75   -keymap select u
0270  73 0a 0a 23 20 42 2e 34 2e 32 2e 20 4e 65 74 77   s..# B.4.2. Netw
0280  6f 72 6b 20 63 6f 6e 66 69 67 75 72 61 74 69 6f   ork configuratio
0290  6e 0a 64 2d 69 20 6e 65 74 63 66 67 2f 63 68 6f   n.d-i netcfg/cho
02a0  6f 73 65 5f 69 6e 74 65 72 66 61 63 65 20 73 65   ose_interface se
02b0  6c 65 63 74 20 65 6e 6f 31 0a 64 2d 69 20 6e 65   lect eno1.d-i ne
02c0  74 63 66 67 2f 75 73 65 5f 61 75 74 6f 63 6f 6e   tcfg/use_autocon
02d0  66 69 67 20 62 6f 6f 6c 65 61 6e 20 74 72 75 65   fig boolean true
02e0  0a 64 2d 69 20 6e 65 74 63 66 67 2f 67 65 74 5f   .d-i netcfg/get_
02f0  6e 61 6d 65 73 65 72 76 65 72 73 20 73 74 72 69   nameservers stri
0300  6e 67 0a 64 2d 69 20 6e 65 74 63 66 67 2f 67 65   ng.d-i netcfg/ge
0310  74 5f 68 6f 73 74 6e 61 6d 65 20 73 74 72 69 6e   t_hostname strin
0320  67 20 64 65 62 69 61 6e 0a 64 2d 69 20 6e 65 74   g debian.d-i net
0330  63 66 67 2f 67 65 74 5f 64 6f 6d 61 69 6e 20 73   cfg/get_domain s
0340  74 72 69 6e 67 0a 0a 23 20 42 2e 34 2e 33 2e 20   tring..# B.4.3. 
0350  4e 65 74 77 6f 72 6b 20 63 6f 6e 73 6f 6c 65 0a   Network console.
0360  0a 23 20 42 2e 34 2e 34 2e 20 4d 69 72 72 6f 72   .# B.4.4. Mirror
0370  20 73 65 74 74 69 6e 67 73 0a 0a 64 2d 69 20 6d    settings..d-i m
0380  69 72 72 6f 72 2f 70 72 6f 74 6f 63 6f 6c 20 73   irror/protocol s
0390  74 72 69 6e 67 20 68 74 74 70 0a 64 2d 69 20 6d   tring http.d-i m
03a0  69 72 72 6f 72 2f 63 6f 75 6e 74 72 79 20 73 74   irror/country st
03b0  72 69 6e 67 20 6d 61 6e 75 61 6c 0a 23 64 2d 69   ring manual.#d-i
03c0  20 6d 69 72 72 6f 72 2f 68 74 74 70 2f 68 6f 73    mirror/http/hos
03d0  74 6e 61 6d 65 20 73 74 72 69 6e 67 20 68 74 74   tname string htt
03e0  70 3a 2f 2f 31 39 32 2e 31 36 38 2e 30 2e 31 30   p://192.168.0.10
03f0  0a 64 2d 69 20 6d 69 72 72 6f 72 2f 68 74 74 70   .d-i mirror/http
0400  2f 68 6f 73 74 6e 61 6d 65 20 73 74 72 69 6e 67   /hostname string
0410  20 68 74 74 70 3a 2f 2f 64 65 62 2e 64 65 62 69    http://deb.debi
0420  61 6e 2e 6f 72 67 0a 64 2d 69 20 6d 69 72 72 6f   an.org.d-i mirro
0430  72 2f 68 74 74 70 2f 64 69 72 65 63 74 6f 72 79   r/http/directory
0440  20 73 74 72 69 6e 67 20 2f 64 65 62 69 61 6e 0a    string /debian.
0450  64 2d 69 20 6d 69 72 72 6f 72 2f 68 74 74 70 2f   d-i mirror/http/
0460  70 72 6f 78 79 20 73 74 72 69 6e 67 0a 0a 23 20   proxy string..# 
0470  42 2e 34 2e 35 2e 20 41 63 63 6f 75 6e 74 20 73   B.4.5. Account s
0480  65 74 75 70 0a 0a 64 2d 69 20 70 61 73 73 77 64   etup..d-i passwd
0490  2f 72 6f 6f 74 2d 6c 6f 67 69 6e 20 62 6f 6f 6c   /root-login bool
04a0  65 61 6e 20 74 72 75 65 0a 64 2d 69 20 70 61 73   ean true.d-i pas
04b0  73 77 64 2f 6d 61 6b 65 2d 75 73 65 72 20 62 6f   swd/make-user bo
04c0  6f 6c 65 61 6e 20 66 61 6c 73 65 0a 64 2d 69 20   olean false.d-i 
04d0  70 61 73 73 77 64 2f 72 6f 6f 74 2d 70 61 73 73   passwd/root-pass
04e0  77 6f 72 64 20 70 61 73 73 77 6f 72 64 20 70 61   word password pa
04f0  73 73 77 6f 72 64 0a 64 2d 69 20 70 61 73 73 77   ssword.d-i passw
0500  64 2f 72 6f 6f 74 2d 70 61 73 73 77 6f 72 64 2d   d/root-password-
0510  61 67 61 69 6e 20 70 61 73 73 77 6f 72 64 20 70   again password p
0520  61 73 73 77 6f 72 64 0a 0a 23 20 42 2e 34 2e 36   assword..# B.4.6
0530  2e 20 43 6c 6f 63 6b 20 61 6e 64 20 74 69 6d 65   . Clock and time
0540  20 7a 6f 6e 65 20 73 65 74 75 70 0a 0a 64 2d 69    zone setup..d-i
0550  20 63 6c 6f 63 6b 2d 73 65 74 75 70 2f 75 74 63    clock-setup/utc
0560  20 62 6f 6f 6c 65 61 6e 20 74 72 75 65 0a 64 2d    boolean true.d-
0570  69 20 74 69 6d 65 2f 7a 6f 6e 65 20 73 74 72 69   i time/zone stri
0580  6e 67 20 45 74 63 2f 55 54 43 0a 64 2d 69 20 63   ng Etc/UTC.d-i c
0590  6c 6f 63 6b 2d 73 65 74 75 70 2f 6e 74 70 20 62   lock-setup/ntp b
05a0  6f 6f 6c 65 61 6e 20 74 72 75 65 0a 64 2d 69 20   oolean true.d-i 
05b0  63 6c 6f 63 6b 2d 73 65 74 75 70 2f 6e 74 70 2d   clock-setup/ntp-
05c0  73 65 72 76 65 72 20 73 74 72 69 6e 67 20 64 65   server string de
05d0  62 69 61 6e 2e 70 6f 6f 6c 2e 6e 74 70 2e 6f 72   bian.pool.ntp.or
05e0  67 0a 0a 23 20 42 2e 34 2e 37 2e 20 50 61 72 74   g..# B.4.7. Part
05f0  69 74 69 6f 6e 69 6e 67 0a 0a 64 2d 69 20 70 61   itioning..d-i pa
0600  72 74 6d 61 6e 2d 61 75 74 6f 2f 64 69 73 6b 20   rtman-auto/disk 
0610  73 74 72 69 6e 67 20 2f 64 65 76 2f 73 64 61 0a   string /dev/sda.
0620  64 2d 69 20 70 61 72 74 6d 61 6e 2d 61 75 74 6f   d-i partman-auto
0630  2f 6d 65 74 68 6f 64 20 73 74 72 69 6e 67 20 72   /method string r
0640  65 67 75 6c 61 72 0a 64 2d 69 20 70 61 72 74 6d   egular.d-i partm
0650  61 6e 2d 61 75 74 6f 2f 63 68 6f 6f 73 65 5f 72   an-auto/choose_r
0660  65 63 69 70 65 20 73 65 6c 65 63 74 20 61 74 6f   ecipe select ato
0670  6d 69 63 0a 64 2d 69 20 70 61 72 74 6d 61 6e 2d   mic.d-i partman-
0680  70 61 72 74 69 74 69 6f 6e 69 6e 67 2f 63 6f 6e   partitioning/con
0690  66 69 72 6d 5f 77 72 69 74 65 5f 6e 65 77 5f 6c   firm_write_new_l
06a0  61 62 65 6c 20 62 6f 6f 6c 65 61 6e 20 74 72 75   abel boolean tru
06b0  65 0a 64 2d 69 20 70 61 72 74 6d 61 6e 2f 63 68   e.d-i partman/ch
06c0  6f 6f 73 65 5f 70 61 72 74 69 74 69 6f 6e 20 73   oose_partition s
06d0  65 6c 65 63 74 20 66 69 6e 69 73 68 0a 64 2d 69   elect finish.d-i
06e0  20 70 61 72 74 6d 61 6e 2f 63 6f 6e 66 69 72 6d    partman/confirm
06f0  20 62 6f 6f 6c 65 61 6e 20 74 72 75 65 0a 64 2d    boolean true.d-
0700  69 20 70 61 72 74 6d 61 6e 2f 63 6f 6e 66 69 72   i partman/confir
0710  6d 5f 6e 6f 6f 76 65 72 77 72 69 74 65 20 62 6f   m_nooverwrite bo
0720  6f 6c 65 61 6e 20 74 72 75 65 0a 0a 23 20 42 2e   olean true..# B.
0730  34 2e 37 2e 33 2e 20 43 6f 6e 74 72 6f 6c 6c 69   4.7.3. Controlli
0740  6e 67 20 68 6f 77 20 70 61 72 74 69 74 69 6f 6e   ng how partition
0750  73 20 61 72 65 20 6d 6f 75 6e 74 65 64 0a 0a 64   s are mounted..d
0760  2d 69 20 70 61 72 74 6d 61 6e 2f 6d 6f 75 6e 74   -i partman/mount
0770  5f 73 74 79 6c 65 20 73 65 6c 65 63 74 20 75 75   _style select uu
0780  69 64 0a 0a 23 20 42 2e 34 2e 38 2e 20 42 61 73   id..# B.4.8. Bas
0790  65 20 73 79 73 74 65 6d 20 69 6e 73 74 61 6c 6c   e system install
07a0  61 74 69 6f 6e 0a 0a 64 2d 69 20 62 61 73 65 2d   ation..d-i base-
07b0  69 6e 73 74 61 6c 6c 65 72 2f 6b 65 72 6e 65 6c   installer/kernel
07c0  2f 69 6d 61 67 65 20 73 74 72 69 6e 67 20 6c 69   /image string li
07d0  6e 75 78 2d 69 6d 61 67 65 2d 61 6d 64 36 34 0a   nux-image-amd64.
07e0  0a 23 20 42 2e 34 2e 39 2e 20 41 70 74 20 73 65   .# B.4.9. Apt se
07f0  74 75 70 0a 64 2d 69 20 64 65 62 69 61 6e 2d 69   tup.d-i debian-i
0800  6e 73 74 61 6c 6c 65 72 2f 61 6c 6c 6f 77 5f 75   nstaller/allow_u
0810  6e 61 75 74 68 65 6e 74 69 63 61 74 65 64 20 62   nauthenticated b
0820  6f 6f 6c 65 61 6e 20 74 72 75 65 0a 0a 23 20 42   oolean true..# B
0830  2e 34 2e 31 30 2e 20 50 61 63 6b 61 67 65 20 73   .4.10. Package s
0840  65 6c 65 63 74 69 6f 6e 0a 0a 74 61 73 6b 73 65   election..taskse
0850  6c 20 74 61 73 6b 73 65 6c 2f 66 69 72 73 74 20   l tasksel/first 
0860  6d 75 6c 74 69 73 65 6c 65 63 74 20 73 74 61 6e   multiselect stan
0870  64 61 72 64 2c 20 73 73 68 2d 73 65 72 76 65 72   dard, ssh-server
0880  2c 20 77 65 62 2d 73 65 72 76 65 72 0a 64 2d 69   , web-server.d-i
0890  20 70 6b 67 73 65 6c 2f 75 70 67 72 61 64 65 20    pkgsel/upgrade 
08a0  73 65 6c 65 63 74 20 66 75 6c 6c 2d 75 70 67 72   select full-upgr
08b0  61 64 65 0a 70 6f 70 75 6c 61 72 69 74 79 2d 63   ade.popularity-c
08c0  6f 6e 74 65 73 74 20 70 6f 70 75 6c 61 72 69 74   ontest popularit
08d0  79 2d 63 6f 6e 74 65 73 74 2f 70 61 72 74 69 63   y-contest/partic
08e0  69 70 61 74 65 20 62 6f 6f 6c 65 61 6e 20 66 61   ipate boolean fa
08f0  6c 73 65 0a 0a 23 20 42 2e 34 2e 31 31 2e 20 42   lse..# B.4.11. B
0900  6f 6f 74 20 6c 6f 61 64 65 72 20 69 6e 73 74 61   oot loader insta
0910  6c 6c 61 74 69 6f 6e 0a 0a 64 2d 69 20 67 72 75   llation..d-i gru
0920  62 2d 69 6e 73 74 61 6c 6c 65 72 2f 6f 6e 6c 79   b-installer/only
0930  5f 64 65 62 69 61 6e 20 62 6f 6f 6c 65 61 6e 20   _debian boolean 
0940  74 72 75 65 0a 64 2d 69 20 67 72 75 62 2d 69 6e   true.d-i grub-in
0950  73 74 61 6c 6c 65 72 2f 62 6f 6f 74 64 65 76 20   staller/bootdev 
0960  73 74 72 69 6e 67 20 2f 64 65 76 2f 73 64 61 0a   string /dev/sda.
0970  0a 23 20 42 2e 34 2e 31 32 2e 20 46 69 6e 69 73   .# B.4.12. Finis
0980  68 69 6e 67 20 75 70 20 74 68 65 20 69 6e 73 74   hing up the inst
0990  61 6c 6c 61 74 69 6f 6e 0a 0a 64 2d 69 20 66 69   allation..d-i fi
09a0  6e 69 73 68 2d 69 6e 73 74 61 6c 6c 2f 72 65 62   nish-install/reb
09b0  6f 6f 74 5f 69 6e 5f 70 72 6f 67 72 65 73 73 20   oot_in_progress 
09c0  6e 6f 74 65 0a 64 2d 69 20 63 64 72 6f 6d 2d 64   note.d-i cdrom-d
09d0  65 74 65 63 74 2f 65 6a 65 63 74 20 62 6f 6f 6c   etect/eject bool
09e0  65 61 6e 20 74 72 75 65 0a 0a 23 20 42 2e 34 2e   ean true..# B.4.
09f0  31 33 2e 20 50 72 65 73 65 65 64 69 6e 67 20 6f   13. Preseeding o
0a00  74 68 65 72 20 70 61 63 6b 61 67 65 73 0a 0a 23   ther packages..#
0a10  20 42 2e 35 2e 31 2e 20 52 75 6e 6e 69 6e 67 20    B.5.1. Running 
0a20  63 75 73 74 6f 6d 20 63 6f 6d 6d 61 6e 64 73 20   custom commands 
0a30  64 75 72 69 6e 67 20 74 68 65 20 69 6e 73 74 61   during the insta
0a40  6c 6c 61 74 69 6f 6e 0a                           llation.

No.     Time           Source                Destination           Protocol Length Info
    219 275.119663     192.168.137.189       199.232.46.132        HTTP     225    GET /debian/dists/oldstable/Release HTTP/1.1 

Frame 219: 225 bytes on wire (1800 bits), 225 bytes captured (1800 bits) on interface \Device\NPF_{B1286BEE-345E-457C-927E-56EECC0F1C80}, id 0
Ethernet II, Src: Dell_fe:af:19 (00:1e:c9:fe:af:19), Dst: HoshinoM_0f:26:02 (00:06:1c:0f:26:02)
Internet Protocol Version 4, Src: 192.168.137.189, Dst: 199.232.46.132
Transmission Control Protocol, Src Port: 35596, Dst Port: 80, Seq: 1, Ack: 1, Len: 159
Hypertext Transfer Protocol

No.     Time           Source                Destination           Protocol Length Info
    327 275.381360     199.232.46.132        192.168.137.189       HTTP     921    HTTP/1.1 200 OK 

Frame 327: 921 bytes on wire (7368 bits), 921 bytes captured (7368 bits) on interface \Device\NPF_{B1286BEE-345E-457C-927E-56EECC0F1C80}, id 0
Ethernet II, Src: HoshinoM_0f:26:02 (00:06:1c:0f:26:02), Dst: Dell_fe:af:19 (00:1e:c9:fe:af:19)
Internet Protocol Version 4, Src: 199.232.46.132, Dst: 192.168.137.189
Transmission Control Protocol, Src Port: 80, Dst Port: 35596, Seq: 113253, Ack: 160, Len: 855
[80 Reassembled TCP Segments (114107 bytes): #221(620), #222(1444), #223(1444), #224(1444), #225(1444), #226(1444), #227(1444), #228(1444), #229(1444), #230(1444), #231(1444), #232(1444), #233(1444), #234(1444), #235(1444), #236(1444), #237]
Hypertext Transfer Protocol

No.     Time           Source                Destination           Protocol Length Info
    382 275.481818     192.168.137.189       199.232.46.132        HTTP     224    GET /debian/dists/bullseye/Release HTTP/1.1 

Frame 382: 224 bytes on wire (1792 bits), 224 bytes captured (1792 bits) on interface \Device\NPF_{B1286BEE-345E-457C-927E-56EECC0F1C80}, id 0
Ethernet II, Src: Dell_fe:af:19 (00:1e:c9:fe:af:19), Dst: HoshinoM_0f:26:02 (00:06:1c:0f:26:02)
Internet Protocol Version 4, Src: 192.168.137.189, Dst: 199.232.46.132
Transmission Control Protocol, Src Port: 35610, Dst Port: 80, Seq: 1, Ack: 1, Len: 158
Hypertext Transfer Protocol

No.     Time           Source                Destination           Protocol Length Info
    493 275.569498     199.232.46.132        192.168.137.189       HTTP     921    HTTP/1.1 200 OK 

Frame 493: 921 bytes on wire (7368 bits), 921 bytes captured (7368 bits) on interface \Device\NPF_{B1286BEE-345E-457C-927E-56EECC0F1C80}, id 0
Ethernet II, Src: HoshinoM_0f:26:02 (00:06:1c:0f:26:02), Dst: Dell_fe:af:19 (00:1e:c9:fe:af:19)
Internet Protocol Version 4, Src: 199.232.46.132, Dst: 192.168.137.189
Transmission Control Protocol, Src Port: 80, Dst Port: 35610, Seq: 113252, Ack: 159, Len: 855
[81 Reassembled TCP Segments (114106 bytes): #384(619), #385(1444), #386(1444), #387(1444), #388(1444), #389(1444), #390(1444), #391(1444), #392(1444), #393(1444), #394(1444), #395(1444), #396(1444), #397(1444), #398(1444), #399(1444), #400]
Hypertext Transfer Protocol

No.     Time           Source                Destination           Protocol Length Info
    551 275.671962     192.168.137.189       199.232.46.132        HTTP     222    GET /debian/dists/stable/Release HTTP/1.1 

Frame 551: 222 bytes on wire (1776 bits), 222 bytes captured (1776 bits) on interface \Device\NPF_{B1286BEE-345E-457C-927E-56EECC0F1C80}, id 0
Ethernet II, Src: Dell_fe:af:19 (00:1e:c9:fe:af:19), Dst: HoshinoM_0f:26:02 (00:06:1c:0f:26:02)
Internet Protocol Version 4, Src: 192.168.137.189, Dst: 199.232.46.132
Transmission Control Protocol, Src Port: 35616, Dst Port: 80, Seq: 1, Ack: 1, Len: 156
Hypertext Transfer Protocol

No.     Time           Source                Destination           Protocol Length Info
    693 275.768957     199.232.46.132        192.168.137.189       HTTP     785    HTTP/1.1 200 OK 

Frame 693: 785 bytes on wire (6280 bits), 785 bytes captured (6280 bits) on interface \Device\NPF_{B1286BEE-345E-457C-927E-56EECC0F1C80}, id 0
Ethernet II, Src: HoshinoM_0f:26:02 (00:06:1c:0f:26:02), Dst: Dell_fe:af:19 (00:1e:c9:fe:af:19)
Internet Protocol Version 4, Src: 199.232.46.132, Dst: 192.168.137.189
Transmission Control Protocol, Src Port: 80, Dst Port: 35616, Seq: 145019, Ack: 157, Len: 719
[104 Reassembled TCP Segments (145737 bytes): #553(618), #554(1444), #555(1444), #556(1444), #557(1444), #558(1444), #559(1444), #560(1444), #561(1444), #562(1444), #563(1444), #564(1444), #565(1444), #566(1444), #567(1444), #569(1444), #57]
Hypertext Transfer Protocol

No.     Time           Source                Destination           Protocol Length Info
    764 275.894975     192.168.137.189       199.232.46.132        HTTP     224    GET /debian/dists/bookworm/Release HTTP/1.1 

Frame 764: 224 bytes on wire (1792 bits), 224 bytes captured (1792 bits) on interface \Device\NPF_{B1286BEE-345E-457C-927E-56EECC0F1C80}, id 0
Ethernet II, Src: Dell_fe:af:19 (00:1e:c9:fe:af:19), Dst: HoshinoM_0f:26:02 (00:06:1c:0f:26:02)
Internet Protocol Version 4, Src: 192.168.137.189, Dst: 199.232.46.132
Transmission Control Protocol, Src Port: 35628, Dst Port: 80, Seq: 1, Ack: 1, Len: 158
Hypertext Transfer Protocol

No.     Time           Source                Destination           Protocol Length Info
    901 275.985342     199.232.46.132        192.168.137.189       HTTP     785    HTTP/1.1 200 OK 

Frame 901: 785 bytes on wire (6280 bits), 785 bytes captured (6280 bits) on interface \Device\NPF_{B1286BEE-345E-457C-927E-56EECC0F1C80}, id 0
Ethernet II, Src: HoshinoM_0f:26:02 (00:06:1c:0f:26:02), Dst: Dell_fe:af:19 (00:1e:c9:fe:af:19)
Internet Protocol Version 4, Src: 199.232.46.132, Dst: 192.168.137.189
Transmission Control Protocol, Src Port: 80, Dst Port: 35628, Seq: 145020, Ack: 159, Len: 719
[103 Reassembled TCP Segments (145738 bytes): #766(619), #767(1444), #768(1444), #769(1444), #770(1444), #771(1444), #772(1444), #773(1444), #774(1444), #775(1444), #776(1444), #777(1444), #778(1444), #779(1444), #780(1444), #781(1444), #78]
Hypertext Transfer Protocol

No.     Time           Source                Destination           Protocol Length Info
    976 276.118129     192.168.137.189       199.232.46.132        HTTP     223    GET /debian/dists/testing/Release HTTP/1.1 

Frame 976: 223 bytes on wire (1784 bits), 223 bytes captured (1784 bits) on interface \Device\NPF_{B1286BEE-345E-457C-927E-56EECC0F1C80}, id 0
Ethernet II, Src: Dell_fe:af:19 (00:1e:c9:fe:af:19), Dst: HoshinoM_0f:26:02 (00:06:1c:0f:26:02)
Internet Protocol Version 4, Src: 192.168.137.189, Dst: 199.232.46.132
Transmission Control Protocol, Src Port: 35630, Dst Port: 80, Seq: 1, Ack: 1, Len: 157
Hypertext Transfer Protocol

No.     Time           Source                Destination           Protocol Length Info
   1157 276.671397     199.232.46.132        192.168.137.189       HTTP     1296   HTTP/1.1 200 OK 

Frame 1157: 1296 bytes on wire (10368 bits), 1296 bytes captured (10368 bits) on interface \Device\NPF_{B1286BEE-345E-457C-927E-56EECC0F1C80}, id 0
Ethernet II, Src: HoshinoM_0f:26:02 (00:06:1c:0f:26:02), Dst: Dell_fe:af:19 (00:1e:c9:fe:af:19)
Internet Protocol Version 4, Src: 199.232.46.132, Dst: 192.168.137.189
Transmission Control Protocol, Src Port: 80, Dst Port: 35630, Seq: 165236, Ack: 158, Len: 1230
[116 Reassembled TCP Segments (166465 bytes): #978(619), #979(1444), #980(1444), #981(1444), #982(1444), #983(1444), #984(1444), #985(1444), #986(1444), #987(1444), #988(1444), #989(1444), #990(1444), #993(1444), #994(1444), #996(1444), #99]
Hypertext Transfer Protocol

No.     Time           Source                Destination           Protocol Length Info
   1185 276.744608     192.168.137.189       199.232.46.132        HTTP     222    GET /debian/dists/trixie/Release HTTP/1.1 

Frame 1185: 222 bytes on wire (1776 bits), 222 bytes captured (1776 bits) on interface \Device\NPF_{B1286BEE-345E-457C-927E-56EECC0F1C80}, id 0
Ethernet II, Src: Dell_fe:af:19 (00:1e:c9:fe:af:19), Dst: HoshinoM_0f:26:02 (00:06:1c:0f:26:02)
Internet Protocol Version 4, Src: 192.168.137.189, Dst: 199.232.46.132
Transmission Control Protocol, Src Port: 35644, Dst Port: 80, Seq: 1, Ack: 1, Len: 156
Hypertext Transfer Protocol

No.     Time           Source                Destination           Protocol Length Info
   1344 276.890382     199.232.46.132        192.168.137.189       HTTP     467    HTTP/1.1 200 OK 

Frame 1344: 467 bytes on wire (3736 bits), 467 bytes captured (3736 bits) on interface \Device\NPF_{B1286BEE-345E-457C-927E-56EECC0F1C80}, id 0
Ethernet II, Src: HoshinoM_0f:26:02 (00:06:1c:0f:26:02), Dst: Dell_fe:af:19 (00:1e:c9:fe:af:19)
Internet Protocol Version 4, Src: 199.232.46.132, Dst: 192.168.137.189
Transmission Control Protocol, Src Port: 80, Dst Port: 35644, Seq: 166061, Ack: 157, Len: 401
[116 Reassembled TCP Segments (166461 bytes): #1187(1444), #1188(1444), #1189(1444), #1190(1444), #1191(1444), #1192(1444), #1193(1444), #1194(1444), #1195(1444), #1196(1444), #1197(1444), #1198(1444), #1199(1444), #1200(1444), #1201(1444),]
Hypertext Transfer Protocol

No.     Time           Source                Destination           Protocol Length Info
   1423 277.032874     192.168.137.189       199.232.46.132        HTTP     224    GET /debian/dists/unstable/Release HTTP/1.1 

Frame 1423: 224 bytes on wire (1792 bits), 224 bytes captured (1792 bits) on interface \Device\NPF_{B1286BEE-345E-457C-927E-56EECC0F1C80}, id 0
Ethernet II, Src: Dell_fe:af:19 (00:1e:c9:fe:af:19), Dst: HoshinoM_0f:26:02 (00:06:1c:0f:26:02)
Internet Protocol Version 4, Src: 192.168.137.189, Dst: 199.232.46.132
Transmission Control Protocol, Src Port: 35650, Dst Port: 80, Seq: 1, Ack: 1, Len: 158
Hypertext Transfer Protocol

No.     Time           Source                Destination           Protocol Length Info
   1665 277.653542     199.232.46.132        192.168.137.189       HTTP     1198   HTTP/1.1 200 OK 

Frame 1665: 1198 bytes on wire (9584 bits), 1198 bytes captured (9584 bits) on interface \Device\NPF_{B1286BEE-345E-457C-927E-56EECC0F1C80}, id 0
Ethernet II, Src: HoshinoM_0f:26:02 (00:06:1c:0f:26:02), Dst: Dell_fe:af:19 (00:1e:c9:fe:af:19)
Internet Protocol Version 4, Src: 199.232.46.132, Dst: 192.168.137.189
Transmission Control Protocol, Src Port: 80, Dst Port: 35650, Seq: 197004, Ack: 159, Len: 1132
[139 Reassembled TCP Segments (198135 bytes): #1425(619), #1426(1444), #1427(1444), #1428(1444), #1429(1444), #1430(1444), #1431(1444), #1432(1444), #1433(1444), #1434(1444), #1435(1444), #1436(1444), #1437(1444), #1438(1444), #1439(1444), ]
Hypertext Transfer Protocol

No.     Time           Source                Destination           Protocol Length Info
   1694 277.709183     192.168.137.189       199.232.46.132        HTTP     219    GET /debian/dists/sid/Release HTTP/1.1 

Frame 1694: 219 bytes on wire (1752 bits), 219 bytes captured (1752 bits) on interface \Device\NPF_{B1286BEE-345E-457C-927E-56EECC0F1C80}, id 0
Ethernet II, Src: Dell_fe:af:19 (00:1e:c9:fe:af:19), Dst: HoshinoM_0f:26:02 (00:06:1c:0f:26:02)
Internet Protocol Version 4, Src: 192.168.137.189, Dst: 199.232.46.132
Transmission Control Protocol, Src Port: 35652, Dst Port: 80, Seq: 1, Ack: 1, Len: 153
Hypertext Transfer Protocol

No.     Time           Source                Destination           Protocol Length Info
   1896 278.028935     199.232.46.132        192.168.137.189       HTTP     1317   HTTP/1.1 200 OK 

Frame 1896: 1317 bytes on wire (10536 bits), 1317 bytes captured (10536 bits) on interface \Device\NPF_{B1286BEE-345E-457C-927E-56EECC0F1C80}, id 0
Ethernet II, Src: HoshinoM_0f:26:02 (00:06:1c:0f:26:02), Dst: Dell_fe:af:19 (00:1e:c9:fe:af:19)
Internet Protocol Version 4, Src: 199.232.46.132, Dst: 192.168.137.189
Transmission Control Protocol, Src Port: 80, Dst Port: 35652, Seq: 196885, Ack: 154, Len: 1251
[139 Reassembled TCP Segments (198135 bytes): #1696(1444), #1697(1444), #1698(1444), #1699(1444), #1700(1444), #1701(1444), #1702(1444), #1703(1444), #1704(1444), #1705(1444), #1706(1444), #1707(500), #1708(1444), #1709(1444), #1710(1444), ]
Hypertext Transfer Protocol

No.     Time           Source                Destination           Protocol Length Info
   1977 278.179894     192.168.137.189       199.232.46.132        HTTP     242    GET /debian/dists/bookworm/main/binary-amd64/Release HTTP/1.1 

Frame 1977: 242 bytes on wire (1936 bits), 242 bytes captured (1936 bits) on interface \Device\NPF_{B1286BEE-345E-457C-927E-56EECC0F1C80}, id 0
Ethernet II, Src: Dell_fe:af:19 (00:1e:c9:fe:af:19), Dst: HoshinoM_0f:26:02 (00:06:1c:0f:26:02)
Internet Protocol Version 4, Src: 192.168.137.189, Dst: 199.232.46.132
Transmission Control Protocol, Src Port: 35658, Dst Port: 80, Seq: 1, Ack: 1, Len: 176
Hypertext Transfer Protocol

No.     Time           Source                Destination           Protocol Length Info
   1980 278.527648     199.232.46.132        192.168.137.189       HTTP     795    HTTP/1.1 200 OK 

Frame 1980: 795 bytes on wire (6360 bits), 795 bytes captured (6360 bits) on interface \Device\NPF_{B1286BEE-345E-457C-927E-56EECC0F1C80}, id 0
Ethernet II, Src: HoshinoM_0f:26:02 (00:06:1c:0f:26:02), Dst: Dell_fe:af:19 (00:1e:c9:fe:af:19)
Internet Protocol Version 4, Src: 199.232.46.132, Dst: 192.168.137.189
Transmission Control Protocol, Src Port: 80, Dst Port: 35658, Seq: 1, Ack: 177, Len: 729
Hypertext Transfer Protocol

No.     Time           Source                Destination           Protocol Length Info
   1993 278.583486     192.168.137.189       199.232.46.132        HTTP     229    GET /debian/dists/bookworm/Release HTTP/1.1 

Frame 1993: 229 bytes on wire (1832 bits), 229 bytes captured (1832 bits) on interface \Device\NPF_{B1286BEE-345E-457C-927E-56EECC0F1C80}, id 0
Ethernet II, Src: Dell_fe:af:19 (00:1e:c9:fe:af:19), Dst: HoshinoM_0f:26:02 (00:06:1c:0f:26:02)
Internet Protocol Version 4, Src: 192.168.137.189, Dst: 199.232.46.132
Transmission Control Protocol, Src Port: 35660, Dst Port: 80, Seq: 1, Ack: 1, Len: 163
Hypertext Transfer Protocol

No.     Time           Source                Destination           Protocol Length Info
   2184 278.780788     199.232.46.132        192.168.137.189       HTTP     785    HTTP/1.1 200 OK 

Frame 2184: 785 bytes on wire (6280 bits), 785 bytes captured (6280 bits) on interface \Device\NPF_{B1286BEE-345E-457C-927E-56EECC0F1C80}, id 0
Ethernet II, Src: HoshinoM_0f:26:02 (00:06:1c:0f:26:02), Dst: Dell_fe:af:19 (00:1e:c9:fe:af:19)
Internet Protocol Version 4, Src: 199.232.46.132, Dst: 192.168.137.189
Transmission Control Protocol, Src Port: 80, Dst Port: 35660, Seq: 145020, Ack: 164, Len: 719
[104 Reassembled TCP Segments (145738 bytes): #1995(619), #1996(1444), #1997(1444), #1998(1444), #1999(1444), #2000(1444), #2001(1444), #2002(1444), #2003(1444), #2004(1444), #2005(1444), #2006(1444), #2007(1444), #2008(1444), #2009(1444), ]
Hypertext Transfer Protocol

No.     Time           Source                Destination           Protocol Length Info
   2208 278.828552     192.168.137.189       199.232.46.132        HTTP     268    GET /debian/dists/bookworm/main/debian-installer/binary-amd64/Packages.xz HTTP/1.1 

Frame 2208: 268 bytes on wire (2144 bits), 268 bytes captured (2144 bits) on interface \Device\NPF_{B1286BEE-345E-457C-927E-56EECC0F1C80}, id 0
Ethernet II, Src: Dell_fe:af:19 (00:1e:c9:fe:af:19), Dst: HoshinoM_0f:26:02 (00:06:1c:0f:26:02)
Internet Protocol Version 4, Src: 192.168.137.189, Dst: 199.232.46.132
Transmission Control Protocol, Src Port: 35664, Dst Port: 80, Seq: 1, Ack: 1, Len: 202
Hypertext Transfer Protocol

No.     Time           Source                Destination           Protocol Length Info
   2267 279.215969     199.232.46.132        192.168.137.189       HTTP     1358   HTTP/1.1 200 OK  (application/x-xz)

Frame 2267: 1358 bytes on wire (10864 bits), 1358 bytes captured (10864 bits) on interface \Device\NPF_{B1286BEE-345E-457C-927E-56EECC0F1C80}, id 0
Ethernet II, Src: HoshinoM_0f:26:02 (00:06:1c:0f:26:02), Dst: Dell_fe:af:19 (00:1e:c9:fe:af:19)
Internet Protocol Version 4, Src: 199.232.46.132, Dst: 192.168.137.189
Transmission Control Protocol, Src Port: 80, Dst Port: 35664, Seq: 51188, Ack: 203, Len: 1292
[38 Reassembled TCP Segments (52479 bytes): #2210(1444), #2211(1444), #2212(1444), #2213(1444), #2214(1444), #2215(1444), #2216(1444), #2217(1444), #2218(1444), #2219(1444), #2220(1444), #2221(500), #2222(1444), #2223(147), #2230(1444), #22]
Hypertext Transfer Protocol
Media Type

No.     Time           Source                Destination           Protocol Length Info
   2293 279.418815     192.168.137.189       199.232.46.132        HTTP     271    GET /debian/dists/bookworm/contrib/debian-installer/binary-amd64/Packages.xz HTTP/1.1 

Frame 2293: 271 bytes on wire (2168 bits), 271 bytes captured (2168 bits) on interface \Device\NPF_{B1286BEE-345E-457C-927E-56EECC0F1C80}, id 0
Ethernet II, Src: Dell_fe:af:19 (00:1e:c9:fe:af:19), Dst: HoshinoM_0f:26:02 (00:06:1c:0f:26:02)
Internet Protocol Version 4, Src: 192.168.137.189, Dst: 199.232.46.132
Transmission Control Protocol, Src Port: 35672, Dst Port: 80, Seq: 1, Ack: 1, Len: 205
Hypertext Transfer Protocol

No.     Time           Source                Destination           Protocol Length Info
   2295 279.614536     199.232.46.132        192.168.137.189       HTTP     1150   HTTP/1.1 200 OK  (application/x-xz)

Frame 2295: 1150 bytes on wire (9200 bits), 1150 bytes captured (9200 bits) on interface \Device\NPF_{B1286BEE-345E-457C-927E-56EECC0F1C80}, id 0
Ethernet II, Src: HoshinoM_0f:26:02 (00:06:1c:0f:26:02), Dst: Dell_fe:af:19 (00:1e:c9:fe:af:19)
Internet Protocol Version 4, Src: 199.232.46.132, Dst: 192.168.137.189
Transmission Control Protocol, Src Port: 80, Dst Port: 35672, Seq: 1, Ack: 206, Len: 1084
Hypertext Transfer Protocol
Media Type

No.     Time           Source                Destination           Protocol Length Info
   2308 279.777581     192.168.137.189       199.232.46.132        HTTP     281    GET /debian/dists/bookworm/non-free-firmware/debian-installer/binary-amd64/Packages.xz HTTP/1.1 

Frame 2308: 281 bytes on wire (2248 bits), 281 bytes captured (2248 bits) on interface \Device\NPF_{B1286BEE-345E-457C-927E-56EECC0F1C80}, id 0
Ethernet II, Src: Dell_fe:af:19 (00:1e:c9:fe:af:19), Dst: HoshinoM_0f:26:02 (00:06:1c:0f:26:02)
Internet Protocol Version 4, Src: 192.168.137.189, Dst: 199.232.46.132
Transmission Control Protocol, Src Port: 35682, Dst Port: 80, Seq: 1, Ack: 1, Len: 215
Hypertext Transfer Protocol

No.     Time           Source                Destination           Protocol Length Info
   2310 280.127181     199.232.46.132        192.168.137.189       HTTP     740    HTTP/1.1 200 OK  (application/x-xz)

Frame 2310: 740 bytes on wire (5920 bits), 740 bytes captured (5920 bits) on interface \Device\NPF_{B1286BEE-345E-457C-927E-56EECC0F1C80}, id 0
Ethernet II, Src: HoshinoM_0f:26:02 (00:06:1c:0f:26:02), Dst: Dell_fe:af:19 (00:1e:c9:fe:af:19)
Internet Protocol Version 4, Src: 199.232.46.132, Dst: 192.168.137.189
Transmission Control Protocol, Src Port: 80, Dst Port: 35682, Seq: 1, Ack: 216, Len: 674
Hypertext Transfer Protocol
Media Type

No.     Time           Source                Destination           Protocol Length Info
   2323 280.289675     192.168.137.189       199.232.46.132        HTTP     272    GET /debian/dists/bookworm/non-free/debian-installer/binary-amd64/Packages.xz HTTP/1.1 

Frame 2323: 272 bytes on wire (2176 bits), 272 bytes captured (2176 bits) on interface \Device\NPF_{B1286BEE-345E-457C-927E-56EECC0F1C80}, id 0
Ethernet II, Src: Dell_fe:af:19 (00:1e:c9:fe:af:19), Dst: HoshinoM_0f:26:02 (00:06:1c:0f:26:02)
Internet Protocol Version 4, Src: 192.168.137.189, Dst: 199.232.46.132
Transmission Control Protocol, Src Port: 35684, Dst Port: 80, Seq: 1, Ack: 1, Len: 206
Hypertext Transfer Protocol

No.     Time           Source                Destination           Protocol Length Info
   2325 280.680672     199.232.46.132        192.168.137.189       HTTP     1198   HTTP/1.1 200 OK  (application/x-xz)

Frame 2325: 1198 bytes on wire (9584 bits), 1198 bytes captured (9584 bits) on interface \Device\NPF_{B1286BEE-345E-457C-927E-56EECC0F1C80}, id 0
Ethernet II, Src: HoshinoM_0f:26:02 (00:06:1c:0f:26:02), Dst: Dell_fe:af:19 (00:1e:c9:fe:af:19)
Internet Protocol Version 4, Src: 199.232.46.132, Dst: 192.168.137.189
Transmission Control Protocol, Src Port: 80, Dst Port: 35684, Seq: 1, Ack: 207, Len: 1132
Hypertext Transfer Protocol
Media Type

No.     Time           Source                Destination           Protocol Length Info
   2338 280.855244     192.168.137.189       199.232.46.132        HTTP     260    GET /debian/pool/main/a/apt-setup/apt-mirror-setup_0.182_all.udeb HTTP/1.1 

Frame 2338: 260 bytes on wire (2080 bits), 260 bytes captured (2080 bits) on interface \Device\NPF_{B1286BEE-345E-457C-927E-56EECC0F1C80}, id 0
Ethernet II, Src: Dell_fe:af:19 (00:1e:c9:fe:af:19), Dst: HoshinoM_0f:26:02 (00:06:1c:0f:26:02)
Internet Protocol Version 4, Src: 192.168.137.189, Dst: 199.232.46.132
Transmission Control Protocol, Src Port: 39790, Dst Port: 80, Seq: 1, Ack: 1, Len: 194
Hypertext Transfer Protocol

No.     Time           Source                Destination           Protocol Length Info
   2382 280.872703     199.232.46.132        192.168.137.189       HTTP     294    HTTP/1.1 200 OK  (application/vnd.debian.binary-package)

Frame 2382: 294 bytes on wire (2352 bits), 294 bytes captured (2352 bits) on interface \Device\NPF_{B1286BEE-345E-457C-927E-56EECC0F1C80}, id 0
Ethernet II, Src: HoshinoM_0f:26:02 (00:06:1c:0f:26:02), Dst: Dell_fe:af:19 (00:1e:c9:fe:af:19)
Internet Protocol Version 4, Src: 199.232.46.132, Dst: 192.168.137.189
Transmission Control Protocol, Src Port: 80, Dst Port: 39790, Seq: 52660, Ack: 195, Len: 228
[38 Reassembled TCP Segments (52887 bytes): #2340(675), #2341(1444), #2342(1444), #2343(1444), #2344(1444), #2345(1444), #2346(1444), #2347(1444), #2348(1444), #2349(1444), #2350(1444), #2351(1444), #2352(1444), #2353(1444), #2354(1444), #2]
Hypertext Transfer Protocol
Media Type

No.     Time           Source                Destination           Protocol Length Info
   2419 281.052926     192.168.137.189       199.232.46.132        HTTP     260    GET /debian/pool/main/a/apt-setup/apt-setup-udeb_0.182_amd64.udeb HTTP/1.1 

Frame 2419: 260 bytes on wire (2080 bits), 260 bytes captured (2080 bits) on interface \Device\NPF_{B1286BEE-345E-457C-927E-56EECC0F1C80}, id 0
Ethernet II, Src: Dell_fe:af:19 (00:1e:c9:fe:af:19), Dst: HoshinoM_0f:26:02 (00:06:1c:0f:26:02)
Internet Protocol Version 4, Src: 192.168.137.189, Dst: 199.232.46.132
Transmission Control Protocol, Src Port: 39804, Dst Port: 80, Seq: 1, Ack: 1, Len: 194
Hypertext Transfer Protocol

No.     Time           Source                Destination           Protocol Length Info
   2494 281.139806     199.232.46.132        192.168.137.189       HTTP     1372   HTTP/1.1 200 OK  (application/vnd.debian.binary-package)

Frame 2494: 1372 bytes on wire (10976 bits), 1372 bytes captured (10976 bits) on interface \Device\NPF_{B1286BEE-345E-457C-927E-56EECC0F1C80}, id 0
Ethernet II, Src: HoshinoM_0f:26:02 (00:06:1c:0f:26:02), Dst: Dell_fe:af:19 (00:1e:c9:fe:af:19)
Internet Protocol Version 4, Src: 199.232.46.132, Dst: 192.168.137.189
Transmission Control Protocol, Src Port: 80, Dst Port: 39804, Seq: 77772, Ack: 195, Len: 1306
[55 Reassembled TCP Segments (79077 bytes): #2421(1444), #2422(1444), #2423(1444), #2424(1444), #2425(1444), #2426(1444), #2427(1444), #2428(1444), #2429(1444), #2430(1444), #2431(1239), #2437(1444), #2438(1444), #2439(1444), #2440(1444), #]
Hypertext Transfer Protocol
Media Type

No.     Time           Source                Destination           Protocol Length Info
   2526 281.339475     192.168.137.189       199.232.46.132        HTTP     263    GET /debian/pool/main/b/base-installer/base-installer_1.213_all.udeb HTTP/1.1 

Frame 2526: 263 bytes on wire (2104 bits), 263 bytes captured (2104 bits) on interface \Device\NPF_{B1286BEE-345E-457C-927E-56EECC0F1C80}, id 0
Ethernet II, Src: Dell_fe:af:19 (00:1e:c9:fe:af:19), Dst: HoshinoM_0f:26:02 (00:06:1c:0f:26:02)
Internet Protocol Version 4, Src: 192.168.137.189, Dst: 199.232.46.132
Transmission Control Protocol, Src Port: 39812, Dst Port: 80, Seq: 1, Ack: 1, Len: 197
Hypertext Transfer Protocol

No.     Time           Source                Destination           Protocol Length Info
   2561 281.357023     199.232.46.132        192.168.137.189       HTTP     170    HTTP/1.1 200 OK  (application/vnd.debian.binary-package)

Frame 2561: 170 bytes on wire (1360 bits), 170 bytes captured (1360 bits) on interface \Device\NPF_{B1286BEE-345E-457C-927E-56EECC0F1C80}, id 0
Ethernet II, Src: HoshinoM_0f:26:02 (00:06:1c:0f:26:02), Dst: Dell_fe:af:19 (00:1e:c9:fe:af:19)
Internet Protocol Version 4, Src: 199.232.46.132, Dst: 192.168.137.189
Transmission Control Protocol, Src Port: 80, Dst Port: 39812, Seq: 42552, Ack: 198, Len: 104
[31 Reassembled TCP Segments (42655 bytes): #2528(675), #2529(1444), #2530(1444), #2531(1444), #2532(1444), #2533(1444), #2534(1444), #2535(1444), #2536(1444), #2537(1444), #2538(1444), #2539(1444), #2540(1444), #2541(1444), #2542(1444), #2]
Hypertext Transfer Protocol
Media Type

No.     Time           Source                Destination           Protocol Length Info
   2594 281.534593     192.168.137.189       199.232.46.132        HTTP     265    GET /debian/pool/main/b/base-installer/bootstrap-base_1.213_amd64.udeb HTTP/1.1 

Frame 2594: 265 bytes on wire (2120 bits), 265 bytes captured (2120 bits) on interface \Device\NPF_{B1286BEE-345E-457C-927E-56EECC0F1C80}, id 0
Ethernet II, Src: Dell_fe:af:19 (00:1e:c9:fe:af:19), Dst: HoshinoM_0f:26:02 (00:06:1c:0f:26:02)
Internet Protocol Version 4, Src: 192.168.137.189, Dst: 199.232.46.132
Transmission Control Protocol, Src Port: 39814, Dst Port: 80, Seq: 1, Ack: 1, Len: 199
Hypertext Transfer Protocol

No.     Time           Source                Destination           Protocol Length Info
   2762 281.705065     199.232.46.132        192.168.137.189       HTTP     658    HTTP/1.1 200 OK  (application/vnd.debian.binary-package)

Frame 2762: 658 bytes on wire (5264 bits), 658 bytes captured (5264 bits) on interface \Device\NPF_{B1286BEE-345E-457C-927E-56EECC0F1C80}, id 0
Ethernet II, Src: HoshinoM_0f:26:02 (00:06:1c:0f:26:02), Dst: Dell_fe:af:19 (00:1e:c9:fe:af:19)
Internet Protocol Version 4, Src: 199.232.46.132, Dst: 192.168.137.189
Transmission Control Protocol, Src Port: 80, Dst Port: 39814, Seq: 136415, Ack: 200, Len: 592
